{
  "schema": "banco.solve/1",
  "schema_version": 1,
  "revision": "rev_b1",
  "answers": [
    {
      "instance": 1,
      "answer": "5"
    },
    {
      "instance": 2,
      "answer": "o3"
    },
    {
      "instance": 3,
      "dont_know": true
    },
    {
      "instance": 4,
      "answer": {
        "n": 5,
        "d": 6
      }
    }
  ]
}
